{
  "schemaVersion": 1,
  "id": "cmt_01HZX8K3Q9AH",
  "siteId": "site_01HZX8K3Q9ST",
  "nodeId": "entry_01HZX8K3Q9FT",
  "source": "native",
  "author": {
    "kind": "erased"
  },
  "status": "deleted",
  "createdAt": "2026-10-12T08:14:03Z",
  "rev": 4,
  "moderation": {
    "action": "delete",
    "actor": {
      "kind": "human",
      "id": "user_01HZX8K3Q9HU"
    },
    "at": "2026-10-21T12:00:00Z",
    "reasonCode": "erasure-request",
    "note": "Text removed on the commenter's request; replies kept.",
    "automated": false
  }
}
