{
  "schemaVersion": 1,
  "id": "cmt_01HZX8K3Q9AG",
  "siteId": "site_01HZX8K3Q9ST",
  "nodeId": "entry_01HZX8K3Q9FT",
  "source": "native",
  "author": {
    "kind": "erased"
  },
  "body": {
    "format": "text",
    "text": "Thanks for the ferry timetable. Does the 07:40 run on Sundays too?"
  },
  "status": "approved",
  "createdAt": "2026-10-12T08:14:03Z",
  "rev": 3,
  "moderation": {
    "action": "erase",
    "actor": {
      "kind": "human",
      "id": "user_01HZX8K3Q9HU"
    },
    "at": "2026-10-20T12:00:00Z",
    "reasonCode": "erasure-request",
    "automated": false
  }
}
